[
  {
    "id": "escape-tlv-01",
    "region": "il",
    "name": "חדר בריחה — המוזיאון האבוד",
    "category": "escape_room",
    "city": "תל אביב",
    "currency": "ILS",
    "price_per_person": 120,
    "group_min": 4,
    "group_max": 40,
    "rating": 4.8,
    "description": "חוויית חדר בריחה במספר חדרים במקביל, כולל טורניר בין צוותים ומנחה צמוד לכל קבוצה.",
    "link": "#",
    "reviews_link": "#",
    "provider": {
      "name": "EscapeCity TLV",
      "phone": "972501234501",
      "email": "book@escapecity.example"
    }
  },
  {
    "id": "food-tlv-02",
    "region": "il",
    "name": "סדנת שף — פסטה מהעולם",
    "category": "food",
    "city": "תל אביב",
    "currency": "ILS",
    "price_per_person": 210,
    "group_min": 6,
    "group_max": 35,
    "rating": 4.9,
    "description": "סדנת בישול קבוצתית עם שף, כולל ארוחה מלאה ויין. מטבח מאובזר וצוות מלווה.",
    "link": "#",
    "reviews_link": "#",
    "provider": {
      "name": "השף הלבן",
      "phone": "972501234502",
      "email": "events@chef.example"
    }
  },
  {
    "id": "boat-hrz-03",
    "region": "il",
    "name": "שייט מפרשיות במרינה הרצליה",
    "category": "boat",
    "city": "הרצליה",
    "currency": "ILS",
    "price_per_person": 180,
    "group_min": 8,
    "group_max": 60,
    "rating": 4.6,
    "description": "שייט של שעתיים עם מוזיקה וכיבוד, אפשרות לעצירת רחצה בים הפתוח.",
    "link": "#",
    "reviews_link": "#",
    "provider": {
      "name": "Sail4U",
      "phone": "972501234503",
      "email": "sail@sail4u.example"
    }
  },
  {
    "id": "outdoor-jlm-04",
    "region": "il",
    "name": "סנפלינג בנחל פרת",
    "category": "outdoor",
    "city": "ירושלים",
    "currency": "ILS",
    "price_per_person": 150,
    "group_min": 10,
    "group_max": 50,
    "rating": 4.7,
    "description": "יום שטח מודרך: סנפלינג, ניווט צוותי ופיקניק מאורגן עם צוות מדריכים מוסמך.",
    "link": "#",
    "reviews_link": "#",
    "provider": {
      "name": "דרך השטח",
      "phone": "972501234504",
      "email": "info@field.example"
    }
  },
  {
    "id": "workshop-tlv-05",
    "region": "il",
    "name": "סדנת גרפיטי בפלורנטין",
    "category": "workshop",
    "city": "תל אביב",
    "currency": "ILS",
    "price_per_person": 95,
    "group_min": 6,
    "group_max": 30,
    "rating": 4.5,
    "description": "סיור אמנות רחוב וסדנת ריסוס שבסופה כל צוות יוצר קיר משלו.",
    "link": "#",
    "reviews_link": "#",
    "provider": {
      "name": "גרפיטיולוגיה",
      "phone": "972501234505",
      "email": "hi@graffiti.example"
    }
  },
  {
    "id": "games-hfa-06",
    "region": "il",
    "name": "באולינג + קארטינג בחיפה",
    "category": "games",
    "city": "חיפה",
    "currency": "ILS",
    "price_per_person": 110,
    "group_min": 4,
    "group_max": 45,
    "rating": 4.3,
    "description": "ערב תחרותי: ליגת באולינג ומרוץ קארטינג, כולל פיצות ושתייה.",
    "link": "#",
    "reviews_link": "#",
    "provider": {
      "name": "SpeedZone חיפה",
      "phone": "972501234506",
      "email": "fun@speedzone.example"
    }
  },
  {
    "id": "karaoke-tlv-07",
    "region": "il",
    "name": "קריוקי פרטי בדיזנגוף",
    "category": "karaoke",
    "city": "תל אביב",
    "currency": "ILS",
    "price_per_person": 85,
    "group_min": 5,
    "group_max": 25,
    "rating": 4.4,
    "description": "חדר קריוקי פרטי לשעתיים עם בר חטיפים ושתייה.",
    "link": "#",
    "reviews_link": "#",
    "provider": {
      "name": "SingIt",
      "phone": "972501234507",
      "email": "party@singit.example"
    }
  },
  {
    "id": "tour-jlm-08",
    "region": "il",
    "name": "סיור קולינרי בשוק מחנה יהודה",
    "category": "tour",
    "city": "ירושלים",
    "currency": "ILS",
    "price_per_person": 130,
    "group_min": 6,
    "group_max": 35,
    "rating": 4.8,
    "description": "סיור טעימות מודרך בין דוכני השוק, כולל טעימות בכל תחנה.",
    "link": "#",
    "reviews_link": "#",
    "provider": {
      "name": "טעמי השוק",
      "phone": "972501234508",
      "email": "tours@shuk.example"
    }
  },
  {
    "id": "food-bsv-10",
    "region": "il",
    "name": "סדנת שוקולד בבאר שבע",
    "category": "food",
    "city": "באר שבע",
    "currency": "ILS",
    "price_per_person": 90,
    "group_min": 4,
    "group_max": 40,
    "rating": 4.6,
    "description": "סדנת פרלינים מתוקה, כל משתתף יוצא עם מארז אישי.",
    "link": "#",
    "reviews_link": "#",
    "provider": {
      "name": "קקאו",
      "phone": "972501234510",
      "email": "sweet@cacao.example"
    }
  },
  {
    "id": "workshop-tlv-12",
    "region": "il",
    "name": "סדנת קוקטיילים",
    "category": "workshop",
    "city": "תל אביב",
    "currency": "ILS",
    "price_per_person": 140,
    "group_min": 6,
    "group_max": 28,
    "rating": 4.7,
    "description": "ברמן מלווה כל צוות בהכנת שלושה קוקטיילים — כולל תחרות.",
    "link": "#",
    "reviews_link": "#",
    "provider": {
      "name": "Shaken",
      "phone": "972501234512",
      "email": "bar@shaken.example"
    }
  },
  {
    "id": "escape-dal-01",
    "region": "dallas",
    "name": "Escape Room — The Heist",
    "category": "escape_room",
    "city": "Downtown Dallas",
    "currency": "USD",
    "price_per_person": 35,
    "group_min": 4,
    "group_max": 36,
    "rating": 4.7,
    "description": "Multi-room escape experience with parallel rooms for team tournaments, host included.",
    "link": "#",
    "reviews_link": "#",
    "provider": {
      "name": "Dallas Escapes",
      "phone": "12145550101",
      "email": "book@dallasescapes.example"
    }
  },
  {
    "id": "games-dal-02",
    "region": "dallas",
    "name": "Bowling & Arcade Night",
    "category": "games",
    "city": "Deep Ellum",
    "currency": "USD",
    "price_per_person": 30,
    "group_min": 6,
    "group_max": 50,
    "rating": 4.4,
    "description": "Private lanes, arcade card per player, pizza and soft drinks included.",
    "link": "#",
    "reviews_link": "#",
    "provider": {
      "name": "StrikeHouse",
      "phone": "12145550102",
      "email": "events@strikehouse.example"
    }
  },
  {
    "id": "food-dal-03",
    "region": "dallas",
    "name": "BBQ Pitmaster Class",
    "category": "food",
    "city": "Fort Worth",
    "currency": "USD",
    "price_per_person": 75,
    "group_min": 6,
    "group_max": 30,
    "rating": 4.9,
    "description": "Hands-on Texas BBQ masterclass with a pitmaster, full lunch included.",
    "link": "#",
    "reviews_link": "#",
    "provider": {
      "name": "Smoke & Oak",
      "phone": "12145550103",
      "email": "bbq@smokeoak.example"
    }
  },
  {
    "id": "outdoor-dal-04",
    "region": "dallas",
    "name": "Kayaking on the Trinity River",
    "category": "outdoor",
    "city": "Trinity Groves",
    "currency": "USD",
    "price_per_person": 45,
    "group_min": 8,
    "group_max": 40,
    "rating": 4.5,
    "description": "Guided group paddle with all gear, safety briefing, and riverside picnic.",
    "link": "#",
    "reviews_link": "#",
    "provider": {
      "name": "Trinity Paddle Co.",
      "phone": "12145550104",
      "email": "go@trinitypaddle.example"
    }
  },
  {
    "id": "sports-dal-05",
    "region": "dallas",
    "name": "Topgolf Team Challenge",
    "category": "sports",
    "city": "The Colony",
    "currency": "USD",
    "price_per_person": 55,
    "group_min": 6,
    "group_max": 60,
    "rating": 4.6,
    "description": "Private hitting bays, team leaderboard game, appetizers and drinks package.",
    "link": "#",
    "reviews_link": "#",
    "provider": {
      "name": "Topgolf Events",
      "phone": "12145550105",
      "email": "groups@topgolf.example"
    }
  },
  {
    "id": "workshop-dal-06",
    "region": "dallas",
    "name": "Paint & Sip Studio",
    "category": "workshop",
    "city": "Bishop Arts",
    "currency": "USD",
    "price_per_person": 40,
    "group_min": 6,
    "group_max": 25,
    "rating": 4.3,
    "description": "Guided painting session with an artist, drinks included, everyone leaves with a canvas.",
    "link": "#",
    "reviews_link": "#",
    "provider": {
      "name": "ArtBar Dallas",
      "phone": "12145550106",
      "email": "hello@artbar.example"
    }
  },
  {
    "id": "tour-dal-07",
    "region": "dallas",
    "name": "Dallas Food Walking Tour",
    "category": "tour",
    "city": "Downtown Dallas",
    "currency": "USD",
    "price_per_person": 60,
    "group_min": 6,
    "group_max": 20,
    "rating": 4.8,
    "description": "Guided tasting walk through downtown eateries — 6 stops, all tastings included.",
    "link": "#",
    "reviews_link": "#",
    "provider": {
      "name": "Taste DFW",
      "phone": "12145550107",
      "email": "tours@tastedfw.example"
    }
  },
  {
    "id": "escape-tlv-13",
    "region": "il",
    "name": "חדר בריחה — הכספת של דיזנגוף",
    "category": "escape_room",
    "city": "תל אביב",
    "currency": "ILS",
    "price_per_person": 110,
    "group_min": 4,
    "group_max": 24,
    "rating": 4.6,
    "description": "שוד הכספת הגדול: חדר בריחה מהיר וטכנולוגי בלב תל אביב, אפשרות לכמה חדרים במקביל.",
    "link": "#",
    "reviews_link": "#",
    "provider": {
      "name": "EscapeBox TLV",
      "phone": "972501234513",
      "email": "play@escapebox.example"
    }
  },
  {
    "id": "escape-jlm-14",
    "region": "il",
    "name": "חדר בריחה — מנהרות הכותל",
    "category": "escape_room",
    "city": "ירושלים",
    "currency": "ILS",
    "price_per_person": 115,
    "group_min": 4,
    "group_max": 28,
    "rating": 4.7,
    "description": "הרפתקת בריחה היסטורית בעיר העתיקה, כולל חידות בשטח פתוח בין תחנות.",
    "link": "#",
    "reviews_link": "#",
    "provider": {
      "name": "JeruEscape",
      "phone": "972501234514",
      "email": "book@jeruescape.example"
    }
  },
  {
    "id": "escape-hfa-15",
    "region": "il",
    "name": "חדר בריחה — הנמל האבוד",
    "category": "escape_room",
    "city": "חיפה",
    "currency": "ILS",
    "price_per_person": 105,
    "group_min": 4,
    "group_max": 24,